{
  "source_commit": "53f18d8b5689a25bc03b647b54eb1a4ba0cd78ef",
  "source_snapshot": "f808f084937fa036ca89560a321819ec0c09e4d0acbcba032e3fdfe2cc03f5b5",
  "run_id": "frozen-source-run",
  "contract_version": "m4-contract-1.0",
  "artifact_subject": null,
  "execution_subject": {
    "kind": "source",
    "source_commit": "53f18d8b5689a25bc03b647b54eb1a4ba0cd78ef",
    "source_snapshot": "f808f084937fa036ca89560a321819ec0c09e4d0acbcba032e3fdfe2cc03f5b5"
  },
  "raw_exit_code": 0,
  "execution_started": true,
  "report_sha256": "e4578942fa6165fc5bdbe1e82ef9af190b7955c8af89eaa73e37fbe60f30e018",
  "tool": {
    "name": "dependency-policy",
    "version": "1.0"
  },
  "command": [
    "<USER_HOME>\\AppData\\Local\\Programs\\Python\\Python314\\python.exe",
    "scripts/dependency_policy.py",
    "--candidate",
    "<USER_HOME>\\Documents\\GitHub\\M4-golden-candidate-lab\\contract-experiment-20261027-s9irmc29\\evidence\\frozen-source-run\\source-context.json",
    "--run-dir",
    "<USER_HOME>\\Documents\\GitHub\\M4-golden-candidate-lab\\contract-experiment-20261027-s9irmc29\\evidence\\frozen-source-run"
  ],
  "wrapper_exit_code": null,
  "policy_exit_code": null
}
