{
  "source_commit": "aaaaaaaaaaaaaaaaaaaaaaaaaaaaaaaaaaaaaaaa",
  "source_snapshot": "bbbbbbbbbbbbbbbbbbbbbbbbbbbbbbbbbbbbbbbbbbbbbbbbbbbbbbbbbbbbbbbb",
  "run_id": "example-fixture",
  "contract_version": "m4-contract-1.0",
  "artifact_subject": null,
  "execution_subject": {
    "kind": "source",
    "source_commit": "aaaaaaaaaaaaaaaaaaaaaaaaaaaaaaaaaaaaaaaa",
    "source_snapshot": "bbbbbbbbbbbbbbbbbbbbbbbbbbbbbbbbbbbbbbbbbbbbbbbbbbbbbbbbbbbbbbbb"
  },
  "raw_exit_code": 0,
  "execution_started": true,
  "report_sha256": "cccccccccccccccccccccccccccccccccccccccccccccccccccccccccccccccc",
  "tool": {
    "name": "pytest",
    "version": "FIXTURE"
  },
  "command": [
    "FIXTURE_NOT_A_REAL_COMMAND"
  ],
  "wrapper_exit_code": null,
  "policy_exit_code": null
}
